aiter/configs/model_configs/dsv4_fp8fp4_tuned_fmoe.csv
cu_num,token,model_dim,inter_dim,expert,topk,act_type,dtype,q_dtype_a,q_dtype_w,q_type,use_g1u1,doweight_stage1,block_m,ksplit,us1,kernelName1,err1,us2,kernelName2,err2,us,run_1stage,xbf16,tflops,bw,_tag
256,1,7168,512,384,6,ActivationType.Silu,torch.bfloat16,torch.float8_e4m3fn,torch.float4_e2m1fn_x2,QuantType.per_1x32,1,0,32,0,18.4899,flydsl_moe1_afp8_wfp4_bf16_t32x128x256_w3_gui_fp8,0.0%,8.7153,flydsl_moe2_afp8_wfp4_bf16_t32x256x256_atomic_bnt2,0.0%,27.2052,0,0,4.86,155407.05,
256,2,7168,512,384,6,ActivationType.Silu,torch.bfloat16,torch.float8_e4m3fn,torch.float4_e2m1fn_x2,QuantType.per_1x32,1,0,32,0,19.5544,flydsl_moe1_afp8_wfp4_bf16_t32x128x256_gui_fp8,0.0%,9.9572,flydsl_moe2_afp8_wfp4_bf16_t32x256x256_atomic_bnt2,0.0%,29.5116,0,0,8.95,143262.36,
256,4,7168,512,384,6,ActivationType.Silu,torch.bfloat16,torch.float8_e4m3fn,torch.float4_e2m1fn_x2,QuantType.per_1x32,1,0,32,0,21.8912,flydsl_moe1_afp8_wfp4_bf16_t32x128x256_w2_gui_xcd4_fp8,0.0%,16.1003,flydsl_moe2_afp8_wfp4_bf16_t32x256x256_atomic_bnt2_xcd4,0.0%,37.9915,0,0,13.91,111286.59,
256,8,7168,512,384,6,ActivationType.Silu,torch.bfloat16,torch.float8_e4m3fn,torch.float4_e2m1fn_x2,QuantType.per_1x32,1,0,32,0,32.3934,flydsl_moe1_afp8_wfp4_bf16_t32x64x256_w3_gui_fp8,0.0%,23.2222,flydsl_moe2_afp8_wfp4_bf16_t32x256x256_atomic_bnt2_xcd4,0.0%,55.6156,0,0,19.0,76022.38,
256,16,7168,512,384,6,ActivationType.Silu,torch.bfloat16,torch.float8_e4m3fn,torch.float4_e2m1fn_x2,QuantType.per_1x32,1,0,32,0,61.1107,flydsl_moe1_afp8_wfp4_bf16_t32x128x256_w3_gui_fp8,0.0%,36.6618,flydsl_moe2_afp8_wfp4_bf16_t32x256x256_atomic_bnt2_xcd4,0.0%,97.7725,0,0,21.62,43245.31,
256,32,7168,512,384,6,ActivationType.Silu,torch.bfloat16,torch.float8_e4m3fn,torch.float4_e2m1fn_x2,QuantType.per_1x32,1,0,32,0,115.8571,flydsl_moe1_afp8_wfp4_bf16_t32x128x256_w4_gui_fp8,0.0%,62.9204,flydsl_moe2_afp8_wfp4_bf16_t32x256x256_atomic_bnt2_xcd4,0.0%,178.7775,0,0,23.65,23652.57,
256,64,7168,512,384,6,ActivationType.Silu,torch.bfloat16,torch.float8_e4m3fn,torch.float4_e2m1fn_x2,QuantType.per_1x32,1,0,32,0,227.1174,flydsl_moe1_afp8_wfp4_bf16_t32x128x256_w3_gui_fp8,0.0%,117.4534,flydsl_moe2_afp8_wfp4_bf16_t32x256x256_atomic_bnt2_xcd4_persist,0.0%,344.5708,0,0,24.54,12273.92,
256,128,7168,512,384,6,ActivationType.Silu,torch.bfloat16,torch.float8_e4m3fn,torch.float4_e2m1fn_x2,QuantType.per_1x32,1,0,32,0,227.6502,flydsl_moe1_afp8_wfp4_bf16_t32x128x256_w3_gui_fp8,0.0%,120.4705,flydsl_moe2_afp8_wfp4_bf16_t32x256x256_atomic_bnt2_xcd4_persist,0.0%,348.1207,0,0,48.58,12152.71,
256,256,7168,512,384,6,ActivationType.Silu,torch.bfloat16,torch.float8_e4m3fn,torch.float4_e2m1fn_x2,QuantType.per_1x32,1,0,32,0,226.7966,flydsl_moe1_afp8_wfp4_bf16_t32x128x256_w3_gui_fp8,0.0%,125.8372,flydsl_moe2_afp8_wfp4_bf16_t16x128x256_atomic_bnt2_sbm32,0.0%,352.6338,0,0,95.91,12004.98,
256,512,7168,512,384,6,ActivationType.Silu,torch.bfloat16,torch.float8_e4m3fn,torch.float4_e2m1fn_x2,QuantType.per_1x32,1,0,32,0,229.3454,flydsl_moe1_afp8_wfp4_bf16_t32x128x256_w3_gui_fp8,0.0%,134.1083,flydsl_moe2_afp8_wfp4_bf16_t32x256x256_atomic_bnt2_persist,0.0%,363.4537,0,0,186.12,11662.75,
256,1024,7168,512,384,6,ActivationType.Silu,torch.bfloat16,torch.float8_e4m3fn,torch.float4_e2m1fn_x2,QuantType.per_1x32,1,0,32,0,231.6457,flydsl_moe1_afp8_wfp4_bf16_t32x128x256_w4_gui_fp8,0.0%,146.8088,flydsl_moe2_afp8_wfp4_bf16_t32x256x256_atomic_bnt2,0.0%,378.4545,0,0,357.48,11229.56,
256,2048,7168,512,384,6,ActivationType.Silu,torch.bfloat16,torch.float8_e4m3fn,torch.float4_e2m1fn_x2,QuantType.per_1x32,1,0,32,0,239.0991,flydsl_moe1_afp8_wfp4_bf16_t32x128x256_w4_gui_fp8,0.0%,172.9702,flydsl_moe2_afp8_wfp4_bf16_t32x256x256_atomic_bnt2,0.0%,412.0693,0,0,656.64,10366.94,
256,4096,7168,512,384,6,ActivationType.Silu,torch.bfloat16,torch.float8_e4m3fn,torch.float4_e2m1fn_x2,QuantType.per_1x32,1,0,64,0,264.1255,flydsl_moe1_afp8_wfp4_bf16_t64x256x256_w4_gui_fp8,0.0%,270.1705,flydsl_moe2_afp8_wfp4_bf16_t64x256x256_reduce,0.0%,534.296,0,0,1012.86,8077.8,
256,8192,7168,512,384,6,ActivationType.Silu,torch.bfloat16,torch.float8_e4m3fn,torch.float4_e2m1fn_x2,QuantType.per_1x32,1,0,128,0,347.0975,flydsl_moe1_afp8_wfp4_bf16_t128x256x256_w4_gui_fp8,0.0%,485.6735,flydsl_moe2_afp8_wfp4_bf16_t64x256x256_reduce_sbm128,0.0%,832.771,0,0,1299.68,5288.39,
256,16384,7168,512,384,6,ActivationType.Silu,torch.bfloat16,torch.float8_e4m3fn,torch.float4_e2m1fn_x2,QuantType.per_1x32,1,0,128,0,636.2115,flydsl_moe1_afp8_wfp4_bf16_t128x256x256_w3_bnt0_gui_fp8,0.0%,873.8894,flydsl_moe2_afp8_wfp4_bf16_t64x256x256_reduce_sbm128,0.0%,1510.1009,0,0,1433.46,3033.03,
256,32768,7168,512,384,6,ActivationType.Silu,torch.bfloat16,torch.float8_e4m3fn,torch.float4_e2m1fn_x2,QuantType.per_1x32,1,0,128,0,1172.8651,flydsl_moe1_afp8_wfp4_bf16_t128x256x256_w4_bnt0_gui_fp8,0.0%,1715.6004,flydsl_moe2_afp8_wfp4_bf16_t64x256x256_reduce_sbm128,0.0%,2888.4655,0,0,1498.83,1707.65,
256,1,7168,768,384,6,ActivationType.Silu,torch.bfloat16,torch.float8_e4m3fn,torch.float4_e2m1fn_x2,QuantType.per_1x32,1,0,32,0,18.7827,flydsl_moe1_afp8_wfp4_bf16_t32x128x256_w4_gui_xcd4_fp8,0.0%,9.3533,flydsl_moe2_afp8_wfp4_bf16_t32x128x256_atomic_bnt2_persist,0.0%,28.136,0,0,7.04,225398.39,
256,2,7168,768,384,6,ActivationType.Silu,torch.bfloat16,torch.float8_e4m3fn,torch.float4_e2m1fn_x2,QuantType.per_1x32,1,0,32,0,21.1768,flydsl_moe1_afp8_wfp4_bf16_t32x128x256_w4_gui_fp8,0.0%,13.128,flydsl_moe2_afp8_wfp4_bf16_t32x128x256_atomic_bnt2_persist,0.0%,34.3048,0,0,11.55,184867.15,
256,4,7168,768,384,6,ActivationType.Silu,torch.bfloat16,torch.float8_e4m3fn,torch.float4_e2m1fn_x2,QuantType.per_1x32,1,0,32,0,25.4114,flydsl_moe1_afp8_wfp4_bf16_t32x64x256_w4_gui_fp8,0.0%,18.2156,flydsl_moe2_afp8_wfp4_bf16_t32x256x256_atomic_bnt2_persist,0.0%,43.627,0,0,18.17,145365.8,
256,8,7168,768,384,6,ActivationType.Silu,torch.bfloat16,torch.float8_e4m3fn,torch.float4_e2m1fn_x2,QuantType.per_1x32,1,0,32,0,51.6497,flydsl_moe1_afp8_wfp4_bf16_t32x128x256_w4_gui_fp8,0.0%,29.1281,flydsl_moe2_afp8_wfp4_bf16_t32x256x256_atomic_bnt2_persist,0.0%,80.7778,0,0,19.63,78511.17,
256,16,7168,768,384,6,ActivationType.Silu,torch.bfloat16,torch.float8_e4m3fn,torch.float4_e2m1fn_x2,QuantType.per_1x32,1,0,32,0,88.9169,flydsl_moe1_afp8_wfp4_bf16_t32x128x256_w4_gui_fp8,0.0%,49.6872,flydsl_moe2_afp8_wfp4_bf16_t32x128x256_atomic_bnt2_persist,0.0%,138.6041,0,0,22.88,45757.17,
256,32,7168,768,384,6,ActivationType.Silu,torch.bfloat16,torch.float8_e4m3fn,torch.float4_e2m1fn_x2,QuantType.per_1x32,1,0,32,0,170.2974,flydsl_moe1_afp8_wfp4_bf16_t32x128x256_w3_gui_fp8,0.0%,91.4564,flydsl_moe2_afp8_wfp4_bf16_t32x128x256_atomic_bnt2_xcd4,0.0%,261.7538,0,0,24.23,24230.69,
256,64,7168,768,384,6,ActivationType.Silu,torch.bfloat16,torch.float8_e4m3fn,torch.float4_e2m1fn_x2,QuantType.per_1x32,1,0,32,0,336.9403,flydsl_moe1_afp8_wfp4_bf16_t32x128x256_w4_gui_fp8,0.0%,171.6227,flydsl_moe2_afp8_wfp4_bf16_t32x128x256_atomic_bnt2_xcd4_persist,0.0%,508.563,0,0,24.94,12472.72,
256,128,7168,768,384,6,ActivationType.Silu,torch.bfloat16,torch.float8_e4m3fn,torch.float4_e2m1fn_x2,QuantType.per_1x32,1,0,32,0,338.3001,flydsl_moe1_afp8_wfp4_bf16_t32x128x256_w3_gui_fp8,0.0%,173.9982,flydsl_moe2_afp8_wfp4_bf16_t32x128x256_atomic_bnt2_persist,0.0%,512.2983,0,0,49.52,12384.46,
256,256,7168,768,384,6,ActivationType.Silu,torch.bfloat16,torch.float8_e4m3fn,torch.float4_e2m1fn_x2,QuantType.per_1x32,1,0,32,0,337.8278,flydsl_moe1_afp8_wfp4_bf16_t32x128x256_w4_gui_fp8,0.0%,181.1126,flydsl_moe2_afp8_wfp4_bf16_t32x128x256_atomic_bnt2,0.0%,518.9404,0,0,97.77,12231.26,
256,512,7168,768,384,6,ActivationType.Silu,torch.bfloat16,torch.float8_e4m3fn,torch.float4_e2m1fn_x2,QuantType.per_1x32,1,0,32,0,340.4637,flydsl_moe1_afp8_wfp4_bf16_t32x128x256_w3_gui_fp8,0.0%,189.2583,flydsl_moe2_afp8_wfp4_bf16_t32x128x256_atomic_bnt2_persist,0.0%,529.722,0,0,191.55,11992.7,
256,1024,7168,768,384,6,ActivationType.Silu,torch.bfloat16,torch.float8_e4m3fn,torch.float4_e2m1fn_x2,QuantType.per_1x32,1,0,32,0,344.8534,flydsl_moe1_afp8_wfp4_bf16_t32x128x256_w4_gui_fp8,0.0%,206.3373,flydsl_moe2_afp8_wfp4_bf16_t32x256x256_atomic_bnt2,0.0%,551.1907,0,0,368.18,11545.56,
256,2048,7168,768,384,6,ActivationType.Silu,torch.bfloat16,torch.float8_e4m3fn,torch.float4_e2m1fn_x2,QuantType.per_1x32,1,0,32,0,361.5763,flydsl_moe1_afp8_wfp4_bf16_t32x128x256_w3_gui_fp8,0.0%,227.7138,flydsl_moe2_afp8_wfp4_bf16_t32x256x256_atomic_bnt2_persist,0.0%,589.2901,0,0,688.75,10836.48,
256,4096,7168,768,384,6,ActivationType.Silu,torch.bfloat16,torch.float8_e4m3fn,torch.float4_e2m1fn_x2,QuantType.per_1x32,1,0,64,0,386.6537,flydsl_moe1_afp8_wfp4_bf16_t64x256x256_w3_gui_fp8,0.0%,312.8577,flydsl_moe2_afp8_wfp4_bf16_t64x256x256_atomic_bnt2,0.0%,699.5114,0,0,1160.45,9191.94,
256,8192,7168,768,384,6,ActivationType.Silu,torch.bfloat16,torch.float8_e4m3fn,torch.float4_e2m1fn_x2,QuantType.per_1x32,1,0,128,0,511.3611,flydsl_moe1_afp8_wfp4_bf16_t128x256x256_w3_gui_fp8,0.0%,585.9543,flydsl_moe2_afp8_wfp4_bf16_t64x128x256_atomic_persist_sbm128,0.0%,1097.3154,0,0,1479.52,5939.9,
256,16384,7168,768,384,6,ActivationType.Silu,torch.bfloat16,torch.float8_e4m3fn,torch.float4_e2m1fn_x2,QuantType.per_1x32,1,0,128,0,948.5525,flydsl_moe1_afp8_wfp4_bf16_t128x256x256_bnt0_gui_fp8,0.0%,1042.6409,flydsl_moe2_afp8_wfp4_bf16_t64x256x256_reduce_sbm128,0.0%,1991.1934,0,0,1630.68,3361.86,
256,32768,7168,768,384,6,ActivationType.Silu,torch.bfloat16,torch.float8_e4m3fn,torch.float4_e2m1fn_x2,QuantType.per_1x32,1,0,128,0,1816.5035,flydsl_moe1_afp8_wfp4_bf16_t128x256x256_w2_bnt0_gui_fp8,0.0%,2029.9637,flydsl_moe2_afp8_wfp4_bf16_t64x256x256_reduce_sbm128,0.0%,3846.4672,0,0,1688.3,1831.92,
256,1,7168,1536,384,6,ActivationType.Silu,torch.bfloat16,torch.float8_e4m3fn,torch.float4_e2m1fn_x2,QuantType.per_1x32,1,0,32,0,20.4073,flydsl_moe1_afp8_wfp4_bf16_t32x128x256_w4_bnt0_gui_fp8,0.0%,13.8181,flydsl_moe2_afp8_wfp4_bf16_t32x128x256_atomic_bnt2_persist,0.0%,34.2254,0,0,11.58,370590.17,
256,2,7168,1536,384,6,ActivationType.Silu,torch.bfloat16,torch.float8_e4m3fn,torch.float4_e2m1fn_x2,QuantType.per_1x32,1,0,32,0,25.2827,flydsl_moe1_afp8_wfp4_bf16_t32x64x256_w3_gui_fp8,0.0%,17.86,flydsl_moe2_afp8_wfp4_bf16_t32x128x256_atomic_bnt2_persist,0.0%,43.1427,0,0,18.37,293992.22,
256,4,7168,1536,384,6,ActivationType.Silu,torch.bfloat16,torch.float8_e4m3fn,torch.float4_e2m1fn_x2,QuantType.per_1x32,1,0,32,0,50.5369,flydsl_moe1_afp8_wfp4_bf16_t32x64x256_w3_gui_fp8,0.0%,28.9978,flydsl_moe2_afp8_wfp4_bf16_t32x256x256_atomic_bnt2_persist,0.0%,79.5347,0,0,19.93,159473.3,
256,8,7168,1536,384,6,ActivationType.Silu,torch.bfloat16,torch.float8_e4m3fn,torch.float4_e2m1fn_x2,QuantType.per_1x32,1,0,32,0,86.816,flydsl_moe1_afp8_wfp4_bf16_t32x128x256_w3_gui_fp8,0.0%,49.1865,flydsl_moe2_afp8_wfp4_bf16_t32x128x256_atomic_bnt2_persist,0.0%,136.0025,0,0,23.31,93261.13,
256,16,7168,1536,384,6,ActivationType.Silu,torch.bfloat16,torch.float8_e4m3fn,torch.float4_e2m1fn_x2,QuantType.per_1x32,1,0,32,0,171.0799,flydsl_moe1_afp8_wfp4_bf16_t32x128x256_w4_gui_fp8,0.0%,90.8206,flydsl_moe2_afp8_wfp4_bf16_t32x256x256_atomic_bnt2_xcd4,0.0%,261.9005,0,0,24.21,48430.3,
256,32,7168,1536,384,6,ActivationType.Silu,torch.bfloat16,torch.float8_e4m3fn,torch.float4_e2m1fn_x2,QuantType.per_1x32,1,0,32,0,336.3454,flydsl_moe1_afp8_wfp4_bf16_t32x128x256_w4_gui_xcd4_fp8,0.0%,173.2903,flydsl_moe2_afp8_wfp4_bf16_t32x256x256_atomic_bnt2_xcd4,0.0%,509.6357,0,0,24.89,24888.88,
256,64,7168,1536,384,6,ActivationType.Silu,torch.bfloat16,torch.float8_e4m3fn,torch.float4_e2m1fn_x2,QuantType.per_1x32,1,0,32,0,673.3172,flydsl_moe1_afp8_wfp4_bf16_t32x64x256_w4_gui_fp8,0.0%,335.4652,flydsl_moe2_afp8_wfp4_bf16_t32x128x256_atomic_bnt2,0.0%,1008.7824,0,0,25.15,12574.52,
256,128,7168,1536,384,6,ActivationType.Silu,torch.bfloat16,torch.float8_e4m3fn,torch.float4_e2m1fn_x2,QuantType.per_1x32,1,0,32,0,690.1582,flydsl_moe1_afp8_wfp4_bf16_t32x128x256_w3_gui_xcd4_fp8,0.0%,342.4631,flydsl_moe2_afp8_wfp4_bf16_t32x256x256_atomic_bnt2_xcd4_persist,0.0%,1032.6213,0,0,49.13,12285.56,
256,1,7168,512,385,7,ActivationType.Silu,torch.bfloat16,torch.float8_e4m3fn,torch.float4_e2m1fn_x2,QuantType.per_1x32,1,0,32,0,18.3042,flydsl_moe1_afp8_wfp4_bf16_t32x128x256_w4_gui_fp8,0.0%,8.7352,flydsl_moe2_afp8_wfp4_bf16_t32x256x256_atomic,0.0%,27.0394,0,0,5.7,156767.16,
256,2,7168,512,385,7,ActivationType.Silu,torch.bfloat16,torch.float8_e4m3fn,torch.float4_e2m1fn_x2,QuantType.per_1x32,1,0,32,0,20.2251,flydsl_moe1_afp8_wfp4_bf16_t32x128x256_w2_gui_fp8,0.0%,12.4074,flydsl_moe2_afp8_wfp4_bf16_t32x256x256_atomic_xcd4,0.0%,32.6325,0,0,9.45,129898.46,
256,4,7168,512,385,7,ActivationType.Silu,torch.bfloat16,torch.float8_e4m3fn,torch.float4_e2m1fn_x2,QuantType.per_1x32,1,0,32,0,21.9888,flydsl_moe1_afp8_wfp4_bf16_t32x128x256_gui_fp8,0.0%,17.2479,flydsl_moe2_afp8_wfp4_bf16_t32x256x256_atomic_bnt2_xcd4,0.0%,39.2367,0,0,15.71,108035.45,
256,8,7168,512,385,7,ActivationType.Silu,torch.bfloat16,torch.float8_e4m3fn,torch.float4_e2m1fn_x2,QuantType.per_1x32,1,0,32,0,37.0281,flydsl_moe1_afp8_wfp4_bf16_t32x128x256_w2_gui_fp8,0.0%,25.8309,flydsl_moe2_afp8_wfp4_bf16_t32x128x256_atomic_bnt2_persist,0.0%,62.859,0,0,19.62,67437.29,
256,16,7168,512,385,7,ActivationType.Silu,torch.bfloat16,torch.float8_e4m3fn,torch.float4_e2m1fn_x2,QuantType.per_1x32,1,0,32,0,71.2231,flydsl_moe1_afp8_wfp4_bf16_t32x128x256_w2_gui_fp8,0.0%,41.8664,flydsl_moe2_afp8_wfp4_bf16_t32x128x256_atomic_bnt2,0.0%,113.0895,0,0,21.81,37485.47,
256,32,7168,512,385,7,ActivationType.Silu,torch.bfloat16,torch.float8_e4m3fn,torch.float4_e2m1fn_x2,QuantType.per_1x32,1,0,32,0,134.8852,flydsl_moe1_afp8_wfp4_bf16_t32x128x256_w3_gui_xcd4_fp8,0.0%,71.8893,flydsl_moe2_afp8_wfp4_bf16_t32x256x256_atomic_bnt2_xcd4_persist,0.0%,206.7745,0,0,23.85,20503.29,
256,64,7168,512,385,7,ActivationType.Silu,torch.bfloat16,torch.float8_e4m3fn,torch.float4_e2m1fn_x2,QuantType.per_1x32,1,0,32,0,232.2826,flydsl_moe1_afp8_wfp4_bf16_t32x128x256_w3_gui_xcd4_fp8,0.0%,119.2028,flydsl_moe2_afp8_wfp4_bf16_t32x256x256_atomic_bnt2_xcd4,0.0%,351.4854,0,0,28.07,12063.79,
256,128,7168,512,385,7,ActivationType.Silu,torch.bfloat16,torch.float8_e4m3fn,torch.float4_e2m1fn_x2,QuantType.per_1x32,1,0,32,0,233.1225,flydsl_moe1_afp8_wfp4_bf16_t32x128x256_w3_gui_fp8,0.0%,121.6478,flydsl_moe2_afp8_wfp4_bf16_t32x256x256_atomic_bnt2_xcd4,0.0%,354.7703,0,0,55.61,11955.96,
256,256,7168,512,385,7,ActivationType.Silu,torch.bfloat16,torch.float8_e4m3fn,torch.float4_e2m1fn_x2,QuantType.per_1x32,1,0,32,0,233.9255,flydsl_moe1_afp8_wfp4_bf16_t32x128x256_w4_gui_fp8,0.0%,127.8476,flydsl_moe2_afp8_wfp4_bf16_t32x256x256_atomic_bnt2_xcd4,0.0%,361.7731,0,0,109.07,11732.14,
256,512,7168,512,385,7,ActivationType.Silu,torch.bfloat16,torch.float8_e4m3fn,torch.float4_e2m1fn_x2,QuantType.per_1x32,1,0,32,0,236.6982,flydsl_moe1_afp8_wfp4_bf16_t32x128x256_w3_gui_fp8,0.0%,136.2029,flydsl_moe2_afp8_wfp4_bf16_t32x256x256_atomic_bnt2_persist,0.0%,372.9011,0,0,211.64,11396.8,
256,1024,7168,512,385,7,ActivationType.Silu,torch.bfloat16,torch.float8_e4m3fn,torch.float4_e2m1fn_x2,QuantType.per_1x32,1,0,32,0,242.7851,flydsl_moe1_afp8_wfp4_bf16_t32x128x256_w3_gui_fp8,0.0%,150.589,flydsl_moe2_afp8_wfp4_bf16_t32x256x256_atomic_bnt2_persist,0.0%,393.3741,0,0,401.25,10831.64,
256,2048,7168,512,385,7,ActivationType.Silu,torch.bfloat16,torch.float8_e4m3fn,torch.float4_e2m1fn_x2,QuantType.per_1x32,1,0,64,0,263.9999,flydsl_moe1_afp8_wfp4_bf16_t64x128x256_w4_gui_fp8,0.0%,194.4444,flydsl_moe2_afp8_wfp4_bf16_t64x256x256_atomic_bnt2,0.0%,458.4443,0,0,688.59,9342.27,
256,4096,7168,512,385,7,ActivationType.Silu,torch.bfloat16,torch.float8_e4m3fn,torch.float4_e2m1fn_x2,QuantType.per_1x32,1,0,128,0,334.0629,flydsl_moe1_afp8_wfp4_bf16_t128x256x256_w4_gui_fp8,0.0%,366.4308,flydsl_moe2_afp8_wfp4_bf16_t64x256x256_reduce_persist_sbm128,0.0%,700.4937,0,0,901.31,6177.0,
256,8192,7168,512,385,7,ActivationType.Silu,torch.bfloat16,torch.float8_e4m3fn,torch.float4_e2m1fn_x2,QuantType.per_1x32,1,0,64,0,561.1524,flydsl_moe1_afp8_wfp4_bf16_t64x256x256_w3_bnt0_gui_xcd4_fp8,0.0%,568.0007,flydsl_moe2_afp8_wfp4_bf16_t64x256x256_reduce_persist,0.0%,1129.1531,0,0,1118.29,3910.04,
256,16384,7168,512,385,7,ActivationType.Silu,torch.bfloat16,torch.float8_e4m3fn,torch.float4_e2m1fn_x2,QuantType.per_1x32,1,0,128,0,853.1494,flydsl_moe1_afp8_wfp4_bf16_t128x256x256_bnt0_gui_fp8,0.0%,1021.9686,flydsl_moe2_afp8_wfp4_bf16_t64x256x256_reduce_persist_sbm128,0.0%,1875.118,0,0,1346.82,2448.48,
256,32768,7168,512,385,7,ActivationType.Silu,torch.bfloat16,torch.float8_e4m3fn,torch.float4_e2m1fn_x2,QuantType.per_1x32,1,0,64,0,1534.5119,flydsl_moe1_afp8_wfp4_bf16_t64x256x256_w3_bnt0_gui_fp8,0.0%,1942.4954,flydsl_moe2_afp8_wfp4_bf16_t64x256x256_reduce_xcd4_persist,0.0%,3477.0073,0,0,1452.65,1421.77,
256,1,7168,768,385,7,ActivationType.Silu,torch.bfloat16,torch.float8_e4m3fn,torch.float4_e2m1fn_x2,QuantType.per_1x32,1,0,32,0,18.8043,flydsl_moe1_afp8_wfp4_bf16_t32x128x256_gui_fp8,0.0%,9.4455,flydsl_moe2_afp8_wfp4_bf16_t32x256x256_atomic_bnt2,0.0%,28.2498,0,0,8.18,225075.02,
256,2,7168,768,385,7,ActivationType.Silu,torch.bfloat16,torch.float8_e4m3fn,torch.float4_e2m1fn_x2,QuantType.per_1x32,1,0,32,0,21.5087,flydsl_moe1_afp8_wfp4_bf16_t32x128x256_gui_fp8,0.0%,14.1321,flydsl_moe2_afp8_wfp4_bf16_t32x256x256_atomic_bnt2,0.0%,35.6408,0,0,12.97,178400.76,
256,4,7168,768,385,7,ActivationType.Silu,torch.bfloat16,torch.float8_e4m3fn,torch.float4_e2m1fn_x2,QuantType.per_1x32,1,0,32,0,28.1243,flydsl_moe1_afp8_wfp4_bf16_t32x64x256_w4_gui_fp8,0.0%,21.5717,flydsl_moe2_afp8_wfp4_bf16_t32x256x256_atomic_bnt2,0.0%,49.696,0,0,18.61,127945.68,
256,8,7168,768,385,7,ActivationType.Silu,torch.bfloat16,torch.float8_e4m3fn,torch.float4_e2m1fn_x2,QuantType.per_1x32,1,0,32,0,55.3463,flydsl_moe1_afp8_wfp4_bf16_t32x128x256_w4_gui_fp8,0.0%,34.1503,flydsl_moe2_afp8_wfp4_bf16_t32x256x256_atomic_bnt2_persist,0.0%,89.4966,0,0,20.67,71047.11,
256,16,7168,768,385,7,ActivationType.Silu,torch.bfloat16,torch.float8_e4m3fn,torch.float4_e2m1fn_x2,QuantType.per_1x32,1,0,32,0,107.2338,flydsl_moe1_afp8_wfp4_bf16_t32x128x256_w2_gui_fp8,0.0%,56.6137,flydsl_moe2_afp8_wfp4_bf16_t32x128x256_atomic_bnt2,0.0%,163.8475,0,0,22.58,38808.32,
256,32,7168,768,385,7,ActivationType.Silu,torch.bfloat16,torch.float8_e4m3fn,torch.float4_e2m1fn_x2,QuantType.per_1x32,1,0,32,0,202.4158,flydsl_moe1_afp8_wfp4_bf16_t32x128x256_w4_gui_fp8,0.0%,104.4152,flydsl_moe2_afp8_wfp4_bf16_t32x128x256_atomic_bnt2_persist,0.0%,306.831,0,0,24.11,20724.73,
256,64,7168,768,385,7,ActivationType.Silu,torch.bfloat16,torch.float8_e4m3fn,torch.float4_e2m1fn_x2,QuantType.per_1x32,1,0,32,0,343.4994,flydsl_moe1_afp8_wfp4_bf16_t32x128x256_w4_gui_xcd4_fp8,0.0%,174.0693,flydsl_moe2_afp8_wfp4_bf16_t32x128x256_atomic_bnt2_persist,0.0%,517.5687,0,0,28.59,12287.6,
256,128,7168,768,385,7,ActivationType.Silu,torch.bfloat16,torch.float8_e4m3fn,torch.float4_e2m1fn_x2,QuantType.per_1x32,1,0,32,0,341.3169,flydsl_moe1_afp8_wfp4_bf16_t32x128x256_w3_gui_fp8,0.0%,176.7186,flydsl_moe2_afp8_wfp4_bf16_t32x128x256_atomic_bnt2_persist,0.0%,518.0355,0,0,57.13,12279.19,
256,256,7168,768,385,7,ActivationType.Silu,torch.bfloat16,torch.float8_e4m3fn,torch.float4_e2m1fn_x2,QuantType.per_1x32,1,0,32,0,345.9027,flydsl_moe1_afp8_wfp4_bf16_t32x128x256_w4_gui_fp8,0.0%,181.9902,flydsl_moe2_afp8_wfp4_bf16_t32x128x256_atomic_bnt2,0.0%,527.8929,0,0,112.13,12055.11,
256,512,7168,768,385,7,ActivationType.Silu,torch.bfloat16,torch.float8_e4m3fn,torch.float4_e2m1fn_x2,QuantType.per_1x32,1,0,32,0,344.7409,flydsl_moe1_afp8_wfp4_bf16_t32x128x256_w3_gui_fp8,0.0%,193.824,flydsl_moe2_afp8_wfp4_bf16_t32x256x256_atomic_bnt2_persist,0.0%,538.5649,0,0,219.81,11826.45,
256,1024,7168,768,385,7,ActivationType.Silu,torch.bfloat16,torch.float8_e4m3fn,torch.float4_e2m1fn_x2,QuantType.per_1x32,1,0,32,0,347.7917,flydsl_moe1_afp8_wfp4_bf16_t32x128x256_w4_gui_fp8,0.0%,208.5205,flydsl_moe2_afp8_wfp4_bf16_t32x256x256_atomic_bnt2,0.0%,556.3122,0,0,425.59,11468.96,
256,2048,7168,768,385,7,ActivationType.Silu,torch.bfloat16,torch.float8_e4m3fn,torch.float4_e2m1fn_x2,QuantType.per_1x32,1,0,64,0,383.8945,flydsl_moe1_afp8_wfp4_bf16_t64x128x256_w3_gui_fp8,0.0%,251.7792,flydsl_moe2_afp8_wfp4_bf16_t64x256x256_atomic_bnt2,0.0%,635.6737,0,0,744.91,10071.74,
256,4096,7168,768,385,7,ActivationType.Silu,torch.bfloat16,torch.float8_e4m3fn,torch.float4_e2m1fn_x2,QuantType.per_1x32,1,0,128,0,494.4527,flydsl_moe1_afp8_wfp4_bf16_t128x256x256_w4_gui_fp8,0.0%,441.3236,flydsl_moe2_afp8_wfp4_bf16_t128x256x256_atomic_persist_sbm128,0.0%,935.7763,0,0,1012.04,6888.81,
256,8192,7168,768,385,7,ActivationType.Silu,torch.bfloat16,torch.float8_e4m3fn,torch.float4_e2m1fn_x2,QuantType.per_1x32,1,0,64,0,834.5119,flydsl_moe1_afp8_wfp4_bf16_t64x256x256_w4_bnt0_gui_xcd4_fp8,0.0%,686.6355,flydsl_moe2_afp8_wfp4_bf16_t64x256x256_atomic,0.0%,1521.1474,0,0,1245.17,4295.75,
256,16384,7168,768,385,7,ActivationType.Silu,torch.bfloat16,torch.float8_e4m3fn,torch.float4_e2m1fn_x2,QuantType.per_1x32,1,0,128,0,1303.9038,flydsl_moe1_afp8_wfp4_bf16_t128x256x256_w4_bnt0_gui_xcd4_fp8,0.0%,1243.4266,flydsl_moe2_afp8_wfp4_bf16_t64x256x256_reduce_persist_sbm128,0.0%,2547.3304,0,0,1487.11,2634.38,
256,32768,7168,768,385,7,ActivationType.Silu,torch.bfloat16,torch.float8_e4m3fn,torch.float4_e2m1fn_x2,QuantType.per_1x32,1,0,128,0,2193.2573,flydsl_moe1_afp8_wfp4_bf16_t128x256x256_bnt0_gui_xcd4_fp8,0.0%,2438.3465,flydsl_moe2_afp8_wfp4_bf16_t64x256x256_reduce_sbm128,0.0%,4631.6038,0,0,1635.79,1524.95,
256,1,7168,1536,385,7,ActivationType.Silu,torch.bfloat16,torch.float8_e4m3fn,torch.float4_e2m1fn_x2,QuantType.per_1x32,1,0,32,0,20.2248,flydsl_moe1_afp8_wfp4_bf16_t32x128x256_w3_gui_fp8,0.0%,14.3302,flydsl_moe2_afp8_wfp4_bf16_t32x128x256_atomic_bnt2,0.0%,34.555,0,0,13.38,368011.2,
256,2,7168,1536,385,7,ActivationType.Silu,torch.bfloat16,torch.float8_e4m3fn,torch.float4_e2m1fn_x2,QuantType.per_1x32,1,0,32,0,27.6152,flydsl_moe1_afp8_wfp4_bf16_t32x64x256_w3_gui_fp8,0.0%,20.7686,flydsl_moe2_afp8_wfp4_bf16_t32x128x256_atomic_bnt2_persist,0.0%,48.3838,0,0,19.11,262828.64,
256,4,7168,1536,385,7,ActivationType.Silu,torch.bfloat16,torch.float8_e4m3fn,torch.float4_e2m1fn_x2,QuantType.per_1x32,1,0,32,0,53.3444,flydsl_moe1_afp8_wfp4_bf16_t32x128x256_w4_gui_fp8,0.0%,32.9763,flydsl_moe2_afp8_wfp4_bf16_t32x128x256_atomic_bnt2,0.0%,86.3207,0,0,21.43,147319.14,
256,8,7168,1536,385,7,ActivationType.Silu,torch.bfloat16,torch.float8_e4m3fn,torch.float4_e2m1fn_x2,QuantType.per_1x32,1,0,32,0,105.7927,flydsl_moe1_afp8_wfp4_bf16_t32x128x256_w2_gui_xcd4_fp8,0.0%,56.8737,flydsl_moe2_afp8_wfp4_bf16_t32x128x256_atomic_bnt2,0.0%,162.6664,0,0,22.74,78177.04,
256,16,7168,1536,385,7,ActivationType.Silu,torch.bfloat16,torch.float8_e4m3fn,torch.float4_e2m1fn_x2,QuantType.per_1x32,1,0,32,0,201.4304,flydsl_moe1_afp8_wfp4_bf16_t32x128x256_w4_gui_xcd4_fp8,0.0%,105.3636,flydsl_moe2_afp8_wfp4_bf16_t32x128x256_atomic_bnt2,0.0%,306.794,0,0,24.12,41451.1,
256,32,7168,1536,385,7,ActivationType.Silu,torch.bfloat16,torch.float8_e4m3fn,torch.float4_e2m1fn_x2,QuantType.per_1x32,1,0,32,0,393.6657,flydsl_moe1_afp8_wfp4_bf16_t32x128x256_w3_gui_fp8,0.0%,205.1997,flydsl_moe2_afp8_wfp4_bf16_t32x256x256_reduce_bnt2_xcd4,0.0%,598.8654,0,0,24.71,21235.65,
256,64,7168,1536,385,7,ActivationType.Silu,torch.bfloat16,torch.float8_e4m3fn,torch.float4_e2m1fn_x2,QuantType.per_1x32,1,0,32,0,688.169,flydsl_moe1_afp8_wfp4_bf16_t32x128x256_w2_gui_fp8,0.0%,342.3677,flydsl_moe2_afp8_wfp4_bf16_t32x256x256_atomic_bnt2_persist,0.0%,1030.5367,0,0,28.72,12341.12,
256,128,7168,1536,385,7,ActivationType.Silu,torch.bfloat16,torch.float8_e4m3fn,torch.float4_e2m1fn_x2,QuantType.per_1x32,1,0,32,0,671.6014,flydsl_moe1_afp8_wfp4_bf16_t32x128x256_w4_gui_fp8,0.0%,341.9041,flydsl_moe2_afp8_wfp4_bf16_t32x256x256_atomic_bnt2_persist,0.0%,1013.5055,0,0,58.4,12549.87,
256,256,7168,1536,385,7,ActivationType.Silu,torch.bfloat16,torch.float8_e4m3fn,torch.float4_e2m1fn_x2,QuantType.per_1x32,1,0,32,0,689.1255,flydsl_moe1_afp8_wfp4_bf16_t32x128x256_w4_gui_fp8,0.0%,350.3777,flydsl_moe2_afp8_wfp4_bf16_t32x128x256_atomic_bnt2,0.0%,1039.5032,0,0,113.88,12238.64,
256,512,7168,1536,385,7,ActivationType.Silu,torch.bfloat16,torch.float8_e4m3fn,torch.float4_e2m1fn_x2,QuantType.per_1x32,1,0,64,0,739.0288,flydsl_moe1_afp8_wfp4_bf16_t64x128x256_w2_bnt0_gui_fp8,0.0%,372.5039,flydsl_moe2_afp8_wfp4_bf16_t32x128x256_atomic_bnt2_sbm64,0.0%,1111.5327,0,0,213.0,11450.51,
256,1024,7168,1536,385,7,ActivationType.Silu,torch.bfloat16,torch.float8_e4m3fn,torch.float4_e2m1fn_x2,QuantType.per_1x32,1,0,64,0,740.9017,flydsl_moe1_afp8_wfp4_bf16_t64x128x256_w4_gui_fp8,0.0%,415.121,flydsl_moe2_afp8_wfp4_bf16_t64x128x256_atomic_bnt2,0.0%,1156.0227,0,0,409.61,11019.36,
256,2048,7168,1536,385,7,ActivationType.Silu,torch.bfloat16,torch.float8_e4m3fn,torch.float4_e2m1fn_x2,QuantType.per_1x32,1,0,64,0,742.4175,flydsl_moe1_afp8_wfp4_bf16_t64x256x256_w4_gui_fp8,0.0%,465.5302,flydsl_moe2_afp8_wfp4_bf16_t64x128x256_atomic_bnt2_persist,0.0%,1207.9477,0,0,784.01,10563.91,
256,4096,7168,1536,385,7,ActivationType.Silu,torch.bfloat16,torch.float8_e4m3fn,torch.float4_e2m1fn_x2,QuantType.per_1x32,1,0,128,0,936.8038,flydsl_moe1_afp8_wfp4_bf16_t128x256x256_w4_gui_fp8,0.0%,782.2681,flydsl_moe2_afp8_wfp4_bf16_t128x128x256_reduce_bnt2_persist,0.0%,1719.0719,0,0,1101.8,7448.6,
256,8192,7168,1536,385,7,ActivationType.Silu,torch.bfloat16,torch.float8_e4m3fn,torch.float4_e2m1fn_x2,QuantType.per_1x32,1,0,64,0,1611.7256,flydsl_moe1_afp8_wfp4_bf16_t64x128x256_w2_bnt0_gui_fp8,0.0%,1069.8835,flydsl_moe2_afp8_wfp4_bf16_t64x128x256_atomic,0.0%,2681.6091,0,0,1412.64,4807.85,
256,16384,7168,1536,385,7,ActivationType.Silu,torch.bfloat16,torch.float8_e4m3fn,torch.float4_e2m1fn_x2,QuantType.per_1x32,1,0,64,0,2477.6596,flydsl_moe1_afp8_wfp4_bf16_t64x256x256_w3_bnt0_gui_fp8,0.0%,1945.4029,flydsl_moe2_afp8_wfp4_bf16_t64x256x256_reduce,0.0%,4423.0625,0,0,1712.91,2954.72,
256,32768,7168,1536,385,7,ActivationType.Silu,torch.bfloat16,torch.float8_e4m3fn,torch.float4_e2m1fn_x2,QuantType.per_1x32,1,0,128,0,4779.4725,flydsl_moe1_afp8_wfp4_bf16_t128x256x256_w3_gui_fp8,0.0%,3812.3245,flydsl_moe2_afp8_wfp4_bf16_t64x128x256_atomic_bnt2_sbm128,0.0%,8591.797,0,0,1763.62,1562.1,
256,8192,7168,768,385,7,ActivationType.Silu,torch.bfloat16,torch.float8_e4m3fn,torch.float4_e2m1fn_x2,QuantType.per_1x32,1,0,64,0,898.7999,cktile_a8w4_bm64,0.0,686.6355,cktile_a8w4_bm64,0.0,1585.4354,0,0,0.0,0.0,flydsl_fallback
256,256,7168,512,385,7,ActivationType.Silu,torch.bfloat16,torch.float8_e4m3fn,torch.float4_e2m1fn_x2,QuantType.per_1x32,1,0,32,0,257.3735,cktile_a8w4_bm32,0.0,148.2768,cktile_a8w4_bm32,0.0,405.6503,0,0,0.0,0.0,flydsl_fallback
256,512,7168,512,385,7,ActivationType.Silu,torch.bfloat16,torch.float8_e4m3fn,torch.float4_e2m1fn_x2,QuantType.per_1x32,1,0,32,0,281.3186,cktile_a8w4_bm32,0.0,159.1795,cktile_a8w4_bm32,0.0,440.4981,0,0,0.0,0.0,flydsl_fallback
256,1024,7168,512,385,7,ActivationType.Silu,torch.bfloat16,torch.float8_e4m3fn,torch.float4_e2m1fn_x2,QuantType.per_1x32,1,0,32,0,286.38800000000003,cktile_a8w4_bm32,0.0,171.4426,cktile_a8w4_bm32,0.0,457.8306,0,0,0.0,0.0,flydsl_fallback
256,2048,7168,512,385,7,ActivationType.Silu,torch.bfloat16,torch.float8_e4m3fn,torch.float4_e2m1fn_x2,QuantType.per_1x32,1,0,32,0,333.5944,cktile_a8w4_bm32,0.0,249.6101,cktile_a8w4_bm32,0.0,583.2045,0,0,0.0,0.0,flydsl_fallback
256,4096,7168,512,385,7,ActivationType.Silu,torch.bfloat16,torch.float8_e4m3fn,torch.float4_e2m1fn_x2,QuantType.per_1x32,1,0,32,0,437.9427,cktile_a8w4_bm32,0.0,368.1529,cktile_a8w4_bm32,0.0,806.0956,0,0,0.0,0.0,flydsl_fallback
256,8192,7168,512,385,7,ActivationType.Silu,torch.bfloat16,torch.float8_e4m3fn,torch.float4_e2m1fn_x2,QuantType.per_1x32,1,0,32,0,615.7547,cktile_a8w4_bm32,0.0,669.5126,cktile_a8w4_bm32,0.0,1285.2673,0,0,0.0,0.0,flydsl_fallback
256,16384,7168,512,385,7,ActivationType.Silu,torch.bfloat16,torch.float8_e4m3fn,torch.float4_e2m1fn_x2,QuantType.per_1x32,1,0,64,0,966.7605,cktile_a8w4_bm64,0.0,1431.0435,cktile_a8w4_bm64,0.0,2397.804,0,0,0.0,0.0,flydsl_fallback
256,32768,7168,512,385,7,ActivationType.Silu,torch.bfloat16,torch.float8_e4m3fn,torch.float4_e2m1fn_x2,QuantType.per_1x32,1,0,64,0,1832.1527,cktile_a8w4_bm64,0.0,2784.4705,cktile_a8w4_bm64,0.0,4616.6232,0,0,0.0,0.0,flydsl_fallback
256,1,7168,768,385,7,ActivationType.Silu,torch.bfloat16,torch.float8_e4m3fn,torch.float4_e2m1fn_x2,QuantType.per_1x32,1,0,32,0,33.9398,cktile_a8w4_bm32,0.0,9.4455,cktile_a8w4_bm32,0.0,43.3853,0,0,0.0,0.0,flydsl_fallback
256,2,7168,768,385,7,ActivationType.Silu,torch.bfloat16,torch.float8_e4m3fn,torch.float4_e2m1fn_x2,QuantType.per_1x32,1,0,32,0,37.826,cktile_a8w4_bm32,0.0,14.1321,cktile_a8w4_bm32,0.0,51.9581,0,0,0.0,0.0,flydsl_fallback
256,4,7168,768,385,7,ActivationType.Silu,torch.bfloat16,torch.float8_e4m3fn,torch.float4_e2m1fn_x2,QuantType.per_1x32,1,0,32,0,40.8855,cktile_a8w4_bm32,0.0,22.8938,cktile_a8w4_bm32,0.0,63.7793,0,0,0.0,0.0,flydsl_fallback
256,8,7168,768,385,7,ActivationType.Silu,torch.bfloat16,torch.float8_e4m3fn,torch.float4_e2m1fn_x2,QuantType.per_1x32,1,0,32,0,71.4071,cktile_a8w4_bm32,0.0,35.7143,cktile_a8w4_bm32,0.0,107.1214,0,0,0.0,0.0,flydsl_fallback
256,16,7168,768,385,7,ActivationType.Silu,torch.bfloat16,torch.float8_e4m3fn,torch.float4_e2m1fn_x2,QuantType.per_1x32,1,0,32,0,115.285,cktile_a8w4_bm32,0.0,59.3226,cktile_a8w4_bm32,0.0,174.6076,0,0,0.0,0.0,flydsl_fallback
256,32,7168,768,385,7,ActivationType.Silu,torch.bfloat16,torch.float8_e4m3fn,torch.float4_e2m1fn_x2,QuantType.per_1x32,1,0,32,0,230.5892,cktile_a8w4_bm32,0.0,115.1084,cktile_a8w4_bm32,0.0,345.6976,0,0,0.0,0.0,flydsl_fallback
256,64,7168,768,385,7,ActivationType.Silu,torch.bfloat16,torch.float8_e4m3fn,torch.float4_e2m1fn_x2,QuantType.per_1x32,1,0,32,0,363.0944,cktile_a8w4_bm32,0.0,190.3046,cktile_a8w4_bm32,0.0,553.399,0,0,0.0,0.0,flydsl_fallback
256,128,7168,768,385,7,ActivationType.Silu,torch.bfloat16,torch.float8_e4m3fn,torch.float4_e2m1fn_x2,QuantType.per_1x32,1,0,32,0,364.4298,cktile_a8w4_bm32,0.0,214.6079,cktile_a8w4_bm32,0.0,579.0377,0,0,0.0,0.0,flydsl_fallback
256,256,7168,768,385,7,ActivationType.Silu,torch.bfloat16,torch.float8_e4m3fn,torch.float4_e2m1fn_x2,QuantType.per_1x32,1,0,32,0,367.2902,cktile_a8w4_bm32,0.0,193.3029,cktile_a8w4_bm32,0.0,560.5931,0,0,0.0,0.0,flydsl_fallback
256,512,7168,768,385,7,ActivationType.Silu,torch.bfloat16,torch.float8_e4m3fn,torch.float4_e2m1fn_x2,QuantType.per_1x32,1,0,32,0,403.3749,cktile_a8w4_bm32,0.0,225.5099,cktile_a8w4_bm32,0.0,628.8848,0,0,0.0,0.0,flydsl_fallback
256,1024,7168,768,385,7,ActivationType.Silu,torch.bfloat16,torch.float8_e4m3fn,torch.float4_e2m1fn_x2,QuantType.per_1x32,1,0,32,0,410.5552,cktile_a8w4_bm32,0.0,231.5723,cktile_a8w4_bm32,0.0,642.1275,0,0,0.0,0.0,flydsl_fallback
256,2048,7168,768,385,7,ActivationType.Silu,torch.bfloat16,torch.float8_e4m3fn,torch.float4_e2m1fn_x2,QuantType.per_1x32,1,0,64,0,466.2607,cktile_a8w4_bm64,0.0,299.6068,cktile_a8w4_bm64,0.0,765.8675,0,0,0.0,0.0,flydsl_fallback
256,4096,7168,768,385,7,ActivationType.Silu,torch.bfloat16,torch.float8_e4m3fn,torch.float4_e2m1fn_x2,QuantType.per_1x32,1,0,32,0,632.7745,cktile_a8w4_bm32,0.0,439.8722,cktile_a8w4_bm32,0.0,1072.6467,0,0,0.0,0.0,flydsl_fallback
256,1,7168,512,385,7,ActivationType.Silu,torch.bfloat16,torch.float8_e4m3fn,torch.float4_e2m1fn_x2,QuantType.per_1x32,1,0,32,0,34.0581,cktile_a8w4_bm32,0.0,8.7352,cktile_a8w4_bm32,0.0,42.7933,0,0,0.0,0.0,flydsl_fallback
256,2,7168,512,385,7,ActivationType.Silu,torch.bfloat16,torch.float8_e4m3fn,torch.float4_e2m1fn_x2,QuantType.per_1x32,1,0,32,0,34.9158,cktile_a8w4_bm32,0.0,13.3473,cktile_a8w4_bm32,0.0,48.2631,0,0,0.0,0.0,flydsl_fallback
256,4,7168,512,385,7,ActivationType.Silu,torch.bfloat16,torch.float8_e4m3fn,torch.float4_e2m1fn_x2,QuantType.per_1x32,1,0,32,0,38.0416,cktile_a8w4_bm32,0.0,19.3432,cktile_a8w4_bm32,0.0,57.3848,0,0,0.0,0.0,flydsl_fallback
256,8,7168,512,385,7,ActivationType.Silu,torch.bfloat16,torch.float8_e4m3fn,torch.float4_e2m1fn_x2,QuantType.per_1x32,1,0,32,0,46.8002,cktile_a8w4_bm32,0.0,29.3862,cktile_a8w4_bm32,0.0,76.1864,0,0,0.0,0.0,flydsl_fallback
256,16,7168,512,385,7,ActivationType.Silu,torch.bfloat16,torch.float8_e4m3fn,torch.float4_e2m1fn_x2,QuantType.per_1x32,1,0,32,0,82.0373,cktile_a8w4_bm32,0.0,47.2715,cktile_a8w4_bm32,0.0,129.3088,0,0,0.0,0.0,flydsl_fallback
256,32,7168,512,385,7,ActivationType.Silu,torch.bfloat16,torch.float8_e4m3fn,torch.float4_e2m1fn_x2,QuantType.per_1x32,1,0,32,0,150.36790000000002,cktile_a8w4_bm32,0.0,85.8573,cktile_a8w4_bm32,0.0,236.2252,0,0,0.0,0.0,flydsl_fallback
256,64,7168,512,385,7,ActivationType.Silu,torch.bfloat16,torch.float8_e4m3fn,torch.float4_e2m1fn_x2,QuantType.per_1x32,1,0,32,0,254.1856,cktile_a8w4_bm32,0.0,138.8478,cktile_a8w4_bm32,0.0,393.0334,0,0,0.0,0.0,flydsl_fallback
256,128,7168,512,385,7,ActivationType.Silu,torch.bfloat16,torch.float8_e4m3fn,torch.float4_e2m1fn_x2,QuantType.per_1x32,1,0,32,0,253.9273,cktile_a8w4_bm32,0.0,144.3044,cktile_a8w4_bm32,0.0,398.2317,0,0,0.0,0.0,flydsl_fallback
256,16384,7168,768,385,7,ActivationType.Silu,torch.bfloat16,torch.float8_e4m3fn,torch.float4_e2m1fn_x2,QuantType.per_1x32,1,0,64,0,1392.5572000000002,cktile_a8w4_bm64,0.0,1320.7728,cktile_a8w4_bm64,0.0,2713.33,0,0,0.0,0.0,flydsl_fallback
256,32768,7168,768,385,7,ActivationType.Silu,torch.bfloat16,torch.float8_e4m3fn,torch.float4_e2m1fn_x2,QuantType.per_1x32,1,0,64,0,2698.9905,cktile_a8w4_bm64,0.0,2641.1538,cktile_a8w4_bm64,0.0,5340.1443,0,0,0.0,0.0,flydsl_fallback
256,1,7168,1536,385,7,ActivationType.Silu,torch.bfloat16,torch.float8_e4m3fn,torch.float4_e2m1fn_x2,QuantType.per_1x32,1,0,32,0,36.3312,cktile_a8w4_bm32,0.0,14.5989,cktile_a8w4_bm32,0.0,50.9301,0,0,0.0,0.0,flydsl_fallback
256,2,7168,1536,385,7,ActivationType.Silu,torch.bfloat16,torch.float8_e4m3fn,torch.float4_e2m1fn_x2,QuantType.per_1x32,1,0,32,0,40.8095,cktile_a8w4_bm32,0.0,20.9274,cktile_a8w4_bm32,0.0,61.7369,0,0,0.0,0.0,flydsl_fallback
256,4,7168,1536,385,7,ActivationType.Silu,torch.bfloat16,torch.float8_e4m3fn,torch.float4_e2m1fn_x2,QuantType.per_1x32,1,0,32,0,79.7767,cktile_a8w4_bm32,0.0,36.3493,cktile_a8w4_bm32,0.0,116.126,0,0,0.0,0.0,flydsl_fallback
256,8,7168,1536,385,7,ActivationType.Silu,torch.bfloat16,torch.float8_e4m3fn,torch.float4_e2m1fn_x2,QuantType.per_1x32,1,0,32,0,111.8149,cktile_a8w4_bm32,0.0,59.8449,cktile_a8w4_bm32,0.0,171.6598,0,0,0.0,0.0,flydsl_fallback
256,16,7168,1536,385,7,ActivationType.Silu,torch.bfloat16,torch.float8_e4m3fn,torch.float4_e2m1fn_x2,QuantType.per_1x32,1,0,32,0,219.2575,cktile_a8w4_bm32,0.0,106.5366,cktile_a8w4_bm32,0.0,325.7941,0,0,0.0,0.0,flydsl_fallback
256,128,7168,1536,385,7,ActivationType.Silu,torch.bfloat16,torch.float8_e4m3fn,torch.float4_e2m1fn_x2,QuantType.per_1x32,1,0,32,0,700.6265000000001,cktile_a8w4_bm32,0.0,348.2141,cktile_a8w4_bm32,0.0,1048.8406,0,0,0.0,0.0,flydsl_fallback
256,1,7168,512,384,6,ActivationType.Silu,torch.bfloat16,torch.float8_e4m3fn,torch.float4_e2m1fn_x2,QuantType.per_1x32,1,0,32,0,33.9919,cktile_a8w4_bm32,0.0,8.7153,cktile_a8w4_bm32,0.0,42.7072,0,0,0.0,0.0,flydsl_fallback
256,2,7168,512,384,6,ActivationType.Silu,torch.bfloat16,torch.float8_e4m3fn,torch.float4_e2m1fn_x2,QuantType.per_1x32,1,0,32,0,34.7616,cktile_a8w4_bm32,0.0,9.9572,cktile_a8w4_bm32,0.0,44.7188,0,0,0.0,0.0,flydsl_fallback
256,4,7168,512,384,6,ActivationType.Silu,torch.bfloat16,torch.float8_e4m3fn,torch.float4_e2m1fn_x2,QuantType.per_1x32,1,0,32,0,37.9672,cktile_a8w4_bm32,0.0,18.7154,cktile_a8w4_bm32,0.0,56.6826,0,0,0.0,0.0,flydsl_fallback
256,8,7168,512,384,6,ActivationType.Silu,torch.bfloat16,torch.float8_e4m3fn,torch.float4_e2m1fn_x2,QuantType.per_1x32,1,0,32,0,42.8108,cktile_a8w4_bm32,0.0,26.6373,cktile_a8w4_bm32,0.0,69.4481,0,0,0.0,0.0,flydsl_fallback
256,16,7168,512,384,6,ActivationType.Silu,torch.bfloat16,torch.float8_e4m3fn,torch.float4_e2m1fn_x2,QuantType.per_1x32,1,0,32,0,131.5815,cktile_a8w4_bm32,0.0,41.9802,cktile_a8w4_bm32,0.0,173.5617,0,0,0.0,0.0,flydsl_fallback
256,32,7168,512,384,6,ActivationType.Silu,torch.bfloat16,torch.float8_e4m3fn,torch.float4_e2m1fn_x2,QuantType.per_1x32,1,0,32,0,189.8519,cktile_a8w4_bm32,0.0,75.4781,cktile_a8w4_bm32,0.0,265.33,0,0,0.0,0.0,flydsl_fallback
256,64,7168,512,384,6,ActivationType.Silu,torch.bfloat16,torch.float8_e4m3fn,torch.float4_e2m1fn_x2,QuantType.per_1x32,1,0,32,0,291.3181,cktile_a8w4_bm32,0.0,139.1174,cktile_a8w4_bm32,0.0,430.4355,0,0,0.0,0.0,flydsl_fallback
256,128,7168,512,384,6,ActivationType.Silu,torch.bfloat16,torch.float8_e4m3fn,torch.float4_e2m1fn_x2,QuantType.per_1x32,1,0,32,0,296.2314,cktile_a8w4_bm32,0.0,143.1775,cktile_a8w4_bm32,0.0,439.4089,0,0,0.0,0.0,flydsl_fallback
256,256,7168,512,384,6,ActivationType.Silu,torch.bfloat16,torch.float8_e4m3fn,torch.float4_e2m1fn_x2,QuantType.per_1x32,1,0,32,0,295.2472,cktile_a8w4_bm32,0.0,149.4275,cktile_a8w4_bm32,0.0,444.6747,0,0,0.0,0.0,flydsl_fallback
256,512,7168,512,384,6,ActivationType.Silu,torch.bfloat16,torch.float8_e4m3fn,torch.float4_e2m1fn_x2,QuantType.per_1x32,1,0,32,0,317.7302,cktile_a8w4_bm32,0.0,159.5788,cktile_a8w4_bm32,0.0,477.309,0,0,0.0,0.0,flydsl_fallback
256,1024,7168,512,384,6,ActivationType.Silu,torch.bfloat16,torch.float8_e4m3fn,torch.float4_e2m1fn_x2,QuantType.per_1x32,1,0,32,0,293.1891,cktile_a8w4_bm32,0.0,167.1457,cktile_a8w4_bm32,0.0,460.3348,0,0,0.0,0.0,flydsl_fallback
256,2048,7168,512,384,6,ActivationType.Silu,torch.bfloat16,torch.float8_e4m3fn,torch.float4_e2m1fn_x2,QuantType.per_1x32,1,0,32,0,335.8345,cktile_a8w4_bm32,0.0,189.7827,cktile_a8w4_bm32,0.0,525.6172,0,0,0.0,0.0,flydsl_fallback
256,4096,7168,512,384,6,ActivationType.Silu,torch.bfloat16,torch.float8_e4m3fn,torch.float4_e2m1fn_x2,QuantType.per_1x32,1,0,32,0,397.3473,cktile_a8w4_bm32,0.0,294.8852,cktile_a8w4_bm32,0.0,692.2325,0,0,0.0,0.0,flydsl_fallback
256,8192,7168,512,384,6,ActivationType.Silu,torch.bfloat16,torch.float8_e4m3fn,torch.float4_e2m1fn_x2,QuantType.per_1x32,1,0,32,0,616.1852,cktile_a8w4_bm32,0.0,558.0845,cktile_a8w4_bm32,0.0,1174.2697,0,0,0.0,0.0,flydsl_fallback
256,16384,7168,512,384,6,ActivationType.Silu,torch.bfloat16,torch.float8_e4m3fn,torch.float4_e2m1fn_x2,QuantType.per_1x32,1,0,32,0,965.4535,cktile_a8w4_bm32,0.0,1099.8019,cktile_a8w4_bm32,0.0,2065.2554,0,0,0.0,0.0,flydsl_fallback
256,32768,7168,512,384,6,ActivationType.Silu,torch.bfloat16,torch.float8_e4m3fn,torch.float4_e2m1fn_x2,QuantType.per_1x32,1,0,64,0,1601.0055,cktile_a8w4_bm64,0.0,2257.9593,cktile_a8w4_bm64,0.0,3858.9648,0,0,0.0,0.0,flydsl_fallback
256,1,7168,768,384,6,ActivationType.Silu,torch.bfloat16,torch.float8_e4m3fn,torch.float4_e2m1fn_x2,QuantType.per_1x32,1,0,32,0,90.483,cktile_a8w4_bm32,0.0,9.3533,cktile_a8w4_bm32,0.0,99.8363,0,0,0.0,0.0,flydsl_fallback
256,2,7168,768,384,6,ActivationType.Silu,torch.bfloat16,torch.float8_e4m3fn,torch.float4_e2m1fn_x2,QuantType.per_1x32,1,0,32,0,42.7165,cktile_a8w4_bm32,0.0,14.1321,cktile_a8w4_bm32,0.0,56.8486,0,0,0.0,0.0,flydsl_fallback
256,4,7168,768,384,6,ActivationType.Silu,torch.bfloat16,torch.float8_e4m3fn,torch.float4_e2m1fn_x2,QuantType.per_1x32,1,0,32,0,90.8854,cktile_a8w4_bm32,0.0,19.8292,cktile_a8w4_bm32,0.0,110.7146,0,0,0.0,0.0,flydsl_fallback
256,8,7168,768,384,6,ActivationType.Silu,torch.bfloat16,torch.float8_e4m3fn,torch.float4_e2m1fn_x2,QuantType.per_1x32,1,0,32,0,84.883,cktile_a8w4_bm32,0.0,31.4314,cktile_a8w4_bm32,0.0,116.3144,0,0,0.0,0.0,flydsl_fallback
256,16,7168,768,384,6,ActivationType.Silu,torch.bfloat16,torch.float8_e4m3fn,torch.float4_e2m1fn_x2,QuantType.per_1x32,1,0,32,0,172.6574,cktile_a8w4_bm32,0.0,52.4455,cktile_a8w4_bm32,0.0,225.1029,0,0,0.0,0.0,flydsl_fallback
256,32,7168,768,384,6,ActivationType.Silu,torch.bfloat16,torch.float8_e4m3fn,torch.float4_e2m1fn_x2,QuantType.per_1x32,1,0,32,0,186.1242,cktile_a8w4_bm32,0.0,98.1427,cktile_a8w4_bm32,0.0,284.2669,0,0,0.0,0.0,flydsl_fallback
256,64,7168,768,384,6,ActivationType.Silu,torch.bfloat16,torch.float8_e4m3fn,torch.float4_e2m1fn_x2,QuantType.per_1x32,1,0,32,0,347.9242,cktile_a8w4_bm32,0.0,182.6095,cktile_a8w4_bm32,0.0,530.5337,0,0,0.0,0.0,flydsl_fallback
256,128,7168,768,384,6,ActivationType.Silu,torch.bfloat16,torch.float8_e4m3fn,torch.float4_e2m1fn_x2,QuantType.per_1x32,1,0,32,0,350.4395,cktile_a8w4_bm32,0.0,185.7705,cktile_a8w4_bm32,0.0,536.21,0,0,0.0,0.0,flydsl_fallback
256,256,7168,768,384,6,ActivationType.Silu,torch.bfloat16,torch.float8_e4m3fn,torch.float4_e2m1fn_x2,QuantType.per_1x32,1,0,32,0,349.6582,cktile_a8w4_bm32,0.0,193.1847,cktile_a8w4_bm32,0.0,542.8429,0,0,0.0,0.0,flydsl_fallback
256,512,7168,768,384,6,ActivationType.Silu,torch.bfloat16,torch.float8_e4m3fn,torch.float4_e2m1fn_x2,QuantType.per_1x32,1,0,32,0,384.4335,cktile_a8w4_bm32,0.0,225.4302,cktile_a8w4_bm32,0.0,609.8637,0,0,0.0,0.0,flydsl_fallback
256,1024,7168,768,384,6,ActivationType.Silu,torch.bfloat16,torch.float8_e4m3fn,torch.float4_e2m1fn_x2,QuantType.per_1x32,1,0,32,0,388.8719,cktile_a8w4_bm32,0.0,236.4843,cktile_a8w4_bm32,0.0,625.3562,0,0,0.0,0.0,flydsl_fallback
256,2048,7168,768,384,6,ActivationType.Silu,torch.bfloat16,torch.float8_e4m3fn,torch.float4_e2m1fn_x2,QuantType.per_1x32,1,0,32,0,399.9563,cktile_a8w4_bm32,0.0,254.5356,cktile_a8w4_bm32,0.0,654.4919,0,0,0.0,0.0,flydsl_fallback
256,4096,7168,768,384,6,ActivationType.Silu,torch.bfloat16,torch.float8_e4m3fn,torch.float4_e2m1fn_x2,QuantType.per_1x32,1,0,64,0,453.5585,cktile_a8w4_bm64,0.0,323.1902,cktile_a8w4_bm64,0.0,776.7487,0,0,0.0,0.0,flydsl_fallback
256,8192,7168,768,384,6,ActivationType.Silu,torch.bfloat16,torch.float8_e4m3fn,torch.float4_e2m1fn_x2,QuantType.per_1x32,1,0,64,0,674.3756,cktile_a8w4_bm64,0.0,559.8345,cktile_a8w4_bm64,0.0,1234.2101,0,0,0.0,0.0,flydsl_fallback
256,16384,7168,768,384,6,ActivationType.Silu,torch.bfloat16,torch.float8_e4m3fn,torch.float4_e2m1fn_x2,QuantType.per_1x32,1,0,64,0,1170.3026,cktile_a8w4_bm64,0.0,1096.7744,cktile_a8w4_bm64,0.0,2267.077,0,0,0.0,0.0,flydsl_fallback
256,32768,7168,768,384,6,ActivationType.Silu,torch.bfloat16,torch.float8_e4m3fn,torch.float4_e2m1fn_x2,QuantType.per_1x32,1,0,64,0,2162.6324,cktile_a8w4_bm64,0.0,2184.5845,cktile_a8w4_bm64,0.0,4347.2169,0,0,0.0,0.0,flydsl_fallback
256,1,7168,1536,384,6,ActivationType.Silu,torch.bfloat16,torch.float8_e4m3fn,torch.float4_e2m1fn_x2,QuantType.per_1x32,1,0,32,0,35.9379,cktile_a8w4_bm32,0.0,13.8181,cktile_a8w4_bm32,0.0,49.756,0,0,0.0,0.0,flydsl_fallback
256,2,7168,1536,384,6,ActivationType.Silu,torch.bfloat16,torch.float8_e4m3fn,torch.float4_e2m1fn_x2,QuantType.per_1x32,1,0,32,0,40.027,cktile_a8w4_bm32,0.0,19.8079,cktile_a8w4_bm32,0.0,59.8349,0,0,0.0,0.0,flydsl_fallback
256,4,7168,1536,384,6,ActivationType.Silu,torch.bfloat16,torch.float8_e4m3fn,torch.float4_e2m1fn_x2,QuantType.per_1x32,1,0,32,0,67.93299999999999,cktile_a8w4_bm32,0.0,33.6234,cktile_a8w4_bm32,0.0,101.5564,0,0,0.0,0.0,flydsl_fallback
256,8,7168,1536,384,6,ActivationType.Silu,torch.bfloat16,torch.float8_e4m3fn,torch.float4_e2m1fn_x2,QuantType.per_1x32,1,0,32,0,107.4391,cktile_a8w4_bm32,0.0,52.0579,cktile_a8w4_bm32,0.0,159.497,0,0,0.0,0.0,flydsl_fallback
256,16,7168,1536,384,6,ActivationType.Silu,torch.bfloat16,torch.float8_e4m3fn,torch.float4_e2m1fn_x2,QuantType.per_1x32,1,0,32,0,185.3449,cktile_a8w4_bm32,0.0,90.8206,cktile_a8w4_bm32,0.0,276.1655,0,0,0.0,0.0,flydsl_fallback
256,32,7168,1536,384,6,ActivationType.Silu,torch.bfloat16,torch.float8_e4m3fn,torch.float4_e2m1fn_x2,QuantType.per_1x32,1,0,32,0,350.5924,cktile_a8w4_bm32,0.0,176.8999,cktile_a8w4_bm32,0.0,527.4923,0,0,0.0,0.0,flydsl_fallback
256,64,7168,1536,384,6,ActivationType.Silu,torch.bfloat16,torch.float8_e4m3fn,torch.float4_e2m1fn_x2,QuantType.per_1x32,1,0,32,0,690.2520999999999,cktile_a8w4_bm32,0.0,341.9324,cktile_a8w4_bm32,0.0,1032.1845,0,0,0.0,0.0,flydsl_fallback
256,1,4096,256,256,6,ActivationType.Silu,torch.bfloat16,torch.float8_e4m3fn,torch.float4_e2m1fn_x2,QuantType.per_1x32,1,0,32,0,12.8974,flydsl_moe1_afp8_wfp4_bf16_t32x128x256_w4_gui_fp8,0.0%,7.5877,flydsl_moe2_afp8_wfp4_bf16_t32x128x256_atomic,0.0%,20.4851,0,0,1.84,39312.41,
256,2,4096,256,256,6,ActivationType.Silu,torch.bfloat16,torch.float8_e4m3fn,torch.float4_e2m1fn_x2,QuantType.per_1x32,1,0,64,0,14.0049,flydsl_moe1_afp8_wfp4_bf16_t64x128x256_w4_gui_fp8,0.0%,9.6162,flydsl_moe2_afp8_wfp4_bf16_t64x128x256_atomic_bnt2,0.0%,23.6211,0,0,3.2,34093.71,
256,4,4096,256,256,6,ActivationType.Silu,torch.bfloat16,torch.float8_e4m3fn,torch.float4_e2m1fn_x2,QuantType.per_1x32,1,0,64,0,14.6713,flydsl_moe1_afp8_wfp4_bf16_t64x128x256_w4_gui_fp8,0.0%,11.9957,flydsl_moe2_afp8_wfp4_bf16_t64x128x256_reduce_bnt2,0.0%,26.667,0,0,5.66,30200.45,
256,8,4096,256,256,6,ActivationType.Silu,torch.bfloat16,torch.float8_e4m3fn,torch.float4_e2m1fn_x2,QuantType.per_1x32,1,0,32,0,14.9626,flydsl_moe1_afp8_wfp4_bf16_t32x128x256_w2_bnt0_gui_fp8,0.0%,13.5107,flydsl_moe2_afp8_wfp4_bf16_t32x256x256_reduce,0.0%,28.4733,0,0,10.61,28286.31,
256,16,4096,256,256,6,ActivationType.Silu,torch.bfloat16,torch.float8_e4m3fn,torch.float4_e2m1fn_x2,QuantType.per_1x32,1,0,32,0,19.3861,flydsl_moe1_afp8_wfp4_bf16_t32x64x256_w4_bnt0_gui_fp8,0.0%,16.3131,flydsl_moe2_afp8_wfp4_bf16_t32x256x256_reduce_persist,0.0%,35.6992,0,0,16.92,22563.61,
256,32,4096,256,256,6,ActivationType.Silu,torch.bfloat16,torch.float8_e4m3fn,torch.float4_e2m1fn_x2,QuantType.per_1x32,1,0,32,0,33.7587,flydsl_moe1_afp8_wfp4_bf16_t32x128x256_w4_bnt0_gui_fp8,0.0%,22.2507,flydsl_moe2_afp8_wfp4_bf16_t32x256x256_reduce_persist,0.0%,56.0094,0,0,21.57,14385.08,
256,64,4096,256,256,6,ActivationType.Silu,torch.bfloat16,torch.float8_e4m3fn,torch.float4_e2m1fn_x2,QuantType.per_1x32,1,0,32,0,43.3979,flydsl_moe1_afp8_wfp4_bf16_t32x64x256_w4_gui_fp8,0.0%,29.0143,flydsl_moe2_afp8_wfp4_bf16_t32x256x256_reduce,0.0%,72.4122,0,0,33.36,11132.0,
256,128,4096,256,256,6,ActivationType.Silu,torch.bfloat16,torch.float8_e4m3fn,torch.float4_e2m1fn_x2,QuantType.per_1x32,1,0,32,0,48.7587,flydsl_moe1_afp8_wfp4_bf16_t32x64x256_w4_gui_fp8,0.0%,34.1859,flydsl_moe2_afp8_wfp4_bf16_t32x256x256_reduce_bnt2_persist,0.0%,82.9446,0,0,58.25,9727.93,
256,256,4096,256,256,6,ActivationType.Silu,torch.bfloat16,torch.float8_e4m3fn,torch.float4_e2m1fn_x2,QuantType.per_1x32,1,0,32,0,50.8344,flydsl_moe1_afp8_wfp4_bf16_t32x64x256_w4_gui_fp8,0.0%,37.1553,flydsl_moe2_afp8_wfp4_bf16_t32x256x256_reduce_bnt2_persist,0.0%,87.9897,0,0,109.83,9188.03,
256,512,4096,256,256,6,ActivationType.Silu,torch.bfloat16,torch.float8_e4m3fn,torch.float4_e2m1fn_x2,QuantType.per_1x32,1,0,32,0,52.7784,flydsl_moe1_afp8_wfp4_bf16_t32x64x256_w4_gui_fp8,0.0%,41.83,flydsl_moe2_afp8_wfp4_bf16_t32x256x256_atomic_bnt2,0.0%,94.6084,0,0,204.29,8578.5,
256,1024,4096,256,256,6,ActivationType.Silu,torch.bfloat16,torch.float8_e4m3fn,torch.float4_e2m1fn_x2,QuantType.per_1x32,1,0,32,0,60.6665,flydsl_moe1_afp8_wfp4_bf16_t32x128x256_w3_gui_fp8,0.0%,52.6596,flydsl_moe2_afp8_wfp4_bf16_t32x128x256_reduce_bnt2_persist,0.0%,113.3261,0,0,341.09,7217.13,
256,2048,4096,256,256,6,ActivationType.Silu,torch.bfloat16,torch.float8_e4m3fn,torch.float4_e2m1fn_x2,QuantType.per_1x32,1,0,32,0,75.032,flydsl_moe1_afp8_wfp4_bf16_t32x128x256_w4_bnt0_gui_xcd4_fp8,0.0%,81.9673,flydsl_moe2_afp8_wfp4_bf16_t32x256x256_reduce,0.0%,156.9993,0,0,492.42,5289.66,
256,4096,4096,256,256,6,ActivationType.Silu,torch.bfloat16,torch.float8_e4m3fn,torch.float4_e2m1fn_x2,QuantType.per_1x32,1,0,128,0,98.4044,flydsl_moe1_afp8_wfp4_bf16_t128x256x256_w4_gui_fp8,0.0%,154.0103,flydsl_moe2_afp8_wfp4_bf16_t128x256x256_reduce_bnt2_persist,0.0%,252.4147,0,0,612.56,3389.81,
256,8192,4096,256,256,6,ActivationType.Silu,torch.bfloat16,torch.float8_e4m3fn,torch.float4_e2m1fn_x2,QuantType.per_1x32,1,0,64,0,166.1665,flydsl_moe1_afp8_wfp4_bf16_t64x256x256_gui_xcd4_fp8,0.0%,276.2316,flydsl_moe2_afp8_wfp4_bf16_t64x256x256_reduce,0.0%,442.3981,0,0,699.0,2047.86,
256,16384,4096,256,256,6,ActivationType.Silu,torch.bfloat16,torch.float8_e4m3fn,torch.float4_e2m1fn_x2,QuantType.per_1x32,1,0,128,0,269.1305,flydsl_moe1_afp8_wfp4_bf16_t128x256x256_w2_bnt0_gui_xcd4_fp8,0.0%,513.319,flydsl_moe2_afp8_wfp4_bf16_t128x256x256_reduce,0.0%,782.4495,0,0,790.43,1286.51,
256,32768,4096,256,256,6,ActivationType.Silu,torch.bfloat16,torch.float8_e4m3fn,torch.float4_e2m1fn_x2,QuantType.per_1x32,1,0,128,0,479.2326,flydsl_moe1_afp8_wfp4_bf16_t128x256x256_w2_bnt0_gui_xcd4_fp8,0.0%,994.8845,flydsl_moe2_afp8_wfp4_bf16_t128x256x256_reduce,0.0%,1474.1171,0,0,839.11,819.45,
256,131072,4096,256,256,6,ActivationType.Silu,torch.bfloat16,torch.float8_e4m3fn,torch.float4_e2m1fn_x2,QuantType.per_1x32,1,0,128,0,1822.4995,flydsl_moe1_afp8_wfp4_bf16_t128x256x256_bnt0_gui_xcd4_fp8,0.0%,3856.5018,flydsl_moe2_afp8_wfp4_bf16_t64x256x256_reduce_xcd4_persist_sbm128,0.0%,5679.0013,0,0,871.25,425.41,
256,1,4096,256,256,6,ActivationType.Silu,torch.bfloat16,torch.float8_e4m3fn,torch.float4_e2m1fn_x2,QuantType.per_1x32,1,0,32,0,25.3631,cktile_a8w4_bm32,0.0,8.5914,cktile_a8w4_bm32,0.0,33.9545,0,0,0.0,0.0,flydsl_fallback
256,2,4096,256,256,6,ActivationType.Silu,torch.bfloat16,torch.float8_e4m3fn,torch.float4_e2m1fn_x2,QuantType.per_1x32,1,0,32,0,26.237,cktile_a8w4_bm32,0.0,7.5537,cktile_a8w4_bm32,0.0,33.7907,0,0,0.0,0.0,flydsl_fallback
256,4,4096,256,256,6,ActivationType.Silu,torch.bfloat16,torch.float8_e4m3fn,torch.float4_e2m1fn_x2,QuantType.per_1x32,1,0,32,0,26.7,cktile_a8w4_bm32,0.0,10.4334,cktile_a8w4_bm32,0.0,37.1334,0,0,0.0,0.0,flydsl_fallback
256,8,4096,256,256,6,ActivationType.Silu,torch.bfloat16,torch.float8_e4m3fn,torch.float4_e2m1fn_x2,QuantType.per_1x32,1,0,32,0,27.6768,cktile_a8w4_bm32,0.0,15.8125,cktile_a8w4_bm32,0.0,43.4893,0,0,0.0,0.0,flydsl_fallback
256,16,4096,256,256,6,ActivationType.Silu,torch.bfloat16,torch.float8_e4m3fn,torch.float4_e2m1fn_x2,QuantType.per_1x32,1,0,32,0,32.0821,cktile_a8w4_bm32,0.0,20.8078,cktile_a8w4_bm32,0.0,52.8899,0,0,0.0,0.0,flydsl_fallback
256,32,4096,256,256,6,ActivationType.Silu,torch.bfloat16,torch.float8_e4m3fn,torch.float4_e2m1fn_x2,QuantType.per_1x32,1,0,32,0,47.1563,cktile_a8w4_bm32,0.0,30.2147,cktile_a8w4_bm32,0.0,77.371,0,0,0.0,0.0,flydsl_fallback
256,64,4096,256,256,6,ActivationType.Silu,torch.bfloat16,torch.float8_e4m3fn,torch.float4_e2m1fn_x2,QuantType.per_1x32,1,0,32,0,52.563100000000006,cktile_a8w4_bm32,0.0,39.4604,cktile_a8w4_bm32,0.0,92.0235,0,0,0.0,0.0,flydsl_fallback
256,128,4096,256,256,6,ActivationType.Silu,torch.bfloat16,torch.float8_e4m3fn,torch.float4_e2m1fn_x2,QuantType.per_1x32,1,0,32,0,58.676100000000005,cktile_a8w4_bm32,0.0,46.1925,cktile_a8w4_bm32,0.0,104.8686,0,0,0.0,0.0,flydsl_fallback
256,256,4096,256,256,6,ActivationType.Silu,torch.bfloat16,torch.float8_e4m3fn,torch.float4_e2m1fn_x2,QuantType.per_1x32,1,0,32,0,60.3815,cktile_a8w4_bm32,0.0,49.4275,cktile_a8w4_bm32,0.0,109.809,0,0,0.0,0.0,flydsl_fallback
256,512,4096,256,256,6,ActivationType.Silu,torch.bfloat16,torch.float8_e4m3fn,torch.float4_e2m1fn_x2,QuantType.per_1x32,1,0,32,0,64.5577,cktile_a8w4_bm32,0.0,51.4701,cktile_a8w4_bm32,0.0,116.0278,0,0,0.0,0.0,flydsl_fallback
256,1024,4096,256,256,6,ActivationType.Silu,torch.bfloat16,torch.float8_e4m3fn,torch.float4_e2m1fn_x2,QuantType.per_1x32,1,0,32,0,74.93650000000001,cktile_a8w4_bm32,0.0,61.7966,cktile_a8w4_bm32,0.0,136.7331,0,0,0.0,0.0,flydsl_fallback
256,2048,4096,256,256,6,ActivationType.Silu,torch.bfloat16,torch.float8_e4m3fn,torch.float4_e2m1fn_x2,QuantType.per_1x32,1,0,32,0,85.117,cktile_a8w4_bm32,0.0,104.0966,cktile_a8w4_bm32,0.0,189.2136,0,0,0.0,0.0,flydsl_fallback
256,4096,4096,256,256,6,ActivationType.Silu,torch.bfloat16,torch.float8_e4m3fn,torch.float4_e2m1fn_x2,QuantType.per_1x32,1,0,32,0,121.1908,cktile_a8w4_bm32,0.0,174.0915,cktile_a8w4_bm32,0.0,295.2823,0,0,0.0,0.0,flydsl_fallback
256,8192,4096,256,256,6,ActivationType.Silu,torch.bfloat16,torch.float8_e4m3fn,torch.float4_e2m1fn_x2,QuantType.per_1x32,1,0,64,0,192.9549,cktile_a8w4_bm64,0.0,329.0175,cktile_a8w4_bm64,0.0,521.9724,0,0,0.0,0.0,flydsl_fallback
256,16384,4096,256,256,6,ActivationType.Silu,torch.bfloat16,torch.float8_e4m3fn,torch.float4_e2m1fn_x2,QuantType.per_1x32,1,0,64,0,329.48530000000005,cktile_a8w4_bm64,0.0,639.364,cktile_a8w4_bm64,0.0,968.8493,0,0,0.0,0.0,flydsl_fallback
256,32768,4096,256,256,6,ActivationType.Silu,torch.bfloat16,torch.float8_e4m3fn,torch.float4_e2m1fn_x2,QuantType.per_1x32,1,0,64,0,614.7645,cktile_a8w4_bm64,0.0,1269.2433,cktile_a8w4_bm64,0.0,1884.0078,0,0,0.0,0.0,flydsl_fallback
256,131072,4096,256,256,6,ActivationType.Silu,torch.bfloat16,torch.float8_e4m3fn,torch.float4_e2m1fn_x2,QuantType.per_1x32,1,0,64,0,2501.0829,cktile_a8w4_bm64,0.0,5285.1745,cktile_a8w4_bm64,0.0,7786.2574,0,0,0.0,0.0,flydsl_fallback
256,1,7168,3072,48,6,ActivationType.Silu,torch.bfloat16,torch.float8_e4m3fn,torch.float4_e2m1fn_x2,QuantType.per_1x32,1,0,64,0,31.8362,flydsl_moe1_afp8_wfp4_bf16_t64x256x256_w2_bnt0_gui_fp8,0.0%,22.1913,flydsl_moe2_afp8_wfp4_bf16_t32x128x256_atomic_sbm64,0.0%,54.0275,0,0,14.67,58690.77,
256,2,7168,3072,48,6,ActivationType.Silu,torch.bfloat16,torch.float8_e4m3fn,torch.float4_e2m1fn_x2,QuantType.per_1x32,1,0,32,0,53.611,flydsl_moe1_afp8_wfp4_bf16_t32x128x256_w4_gui_xcd4_fp8,0.0%,31.7527,flydsl_moe2_afp8_wfp4_bf16_t32x128x256_atomic,0.0%,85.3637,0,0,18.57,37146.2,
256,4,7168,3072,48,6,ActivationType.Silu,torch.bfloat16,torch.float8_e4m3fn,torch.float4_e2m1fn_x2,QuantType.per_1x32,1,0,32,0,79.0055,flydsl_moe1_afp8_wfp4_bf16_t32x128x256_w2_gui_fp8,0.0%,48.828,flydsl_moe2_afp8_wfp4_bf16_t32x256x256_atomic_bnt2_xcd4_persist,0.0%,127.8335,0,0,24.8,24805.55,
256,8,7168,3072,48,6,ActivationType.Silu,torch.bfloat16,torch.float8_e4m3fn,torch.float4_e2m1fn_x2,QuantType.per_1x32,1,0,32,0,114.5481,flydsl_moe1_afp8_wfp4_bf16_t32x128x256_w3_gui_fp8,0.0%,66.7004,flydsl_moe2_afp8_wfp4_bf16_t32x128x256_atomic_bnt2,0.0%,181.2485,0,0,34.99,17495.68,
256,16,7168,3072,48,6,ActivationType.Silu,torch.bfloat16,torch.float8_e4m3fn,torch.float4_e2m1fn_x2,QuantType.per_1x32,1,0,64,0,176.1964,flydsl_moe1_afp8_wfp4_bf16_t64x256x256_w2_gui_xcd4,0.0%,86.1578,flydsl_moe2_afp8_wfp4_bf16_t64x256x256_atomic_bnt2,0.0%,262.3542,0,0,48.34,12087.61,
256,32,7168,3072,48,6,ActivationType.Silu,torch.bfloat16,torch.float8_e4m3fn,torch.float4_e2m1fn_x2,QuantType.per_1x32,1,0,32,0,175.2447,flydsl_moe1_afp8_wfp4_bf16_t32x128x256_w4_gui_fp8,0.0%,96.6524,flydsl_moe2_afp8_wfp4_bf16_t32x128x256_atomic_bnt2,0.0%,271.8971,0,0,93.3,11664.64,
256,64,7168,3072,48,6,ActivationType.Silu,torch.bfloat16,torch.float8_e4m3fn,torch.float4_e2m1fn_x2,QuantType.per_1x32,1,0,32,0,177.6586,flydsl_moe1_afp8_wfp4_bf16_t32x128x256_w4_gui_fp8,0.0%,99.6762,flydsl_moe2_afp8_wfp4_bf16_t32x256x256_atomic_bnt2,0.0%,277.3348,0,0,182.94,11438.41,
256,128,7168,3072,48,6,ActivationType.Silu,torch.bfloat16,torch.float8_e4m3fn,torch.float4_e2m1fn_x2,QuantType.per_1x32,1,0,64,0,185.2411,flydsl_moe1_afp8_wfp4_bf16_t64x128x256_w3_gui_fp8,0.0%,106.2691,flydsl_moe2_afp8_wfp4_bf16_t32x256x256_atomic_bnt2_persist_sbm64,0.0%,291.5102,0,0,348.08,10886.91,
256,256,7168,3072,48,6,ActivationType.Silu,torch.bfloat16,torch.float8_e4m3fn,torch.float4_e2m1fn_x2,QuantType.per_1x32,1,0,64,0,188.6432,flydsl_moe1_afp8_wfp4_bf16_t64x128x256_w3_gui_fp8,0.0%,111.1665,flydsl_moe2_afp8_wfp4_bf16_t64x256x256_atomic_bnt2,0.0%,299.8097,0,0,676.89,10594.72,
256,512,7168,3072,48,6,ActivationType.Silu,torch.bfloat16,torch.float8_e4m3fn,torch.float4_e2m1fn_x2,QuantType.per_1x32,1,0,64,0,229.5839,flydsl_moe1_afp8_wfp4_bf16_t64x256x256_w4_bnt0_gui_fp8,0.0%,143.482,flydsl_moe2_afp8_wfp4_bf16_t64x256x256_atomic_persist,0.0%,373.0659,0,0,1087.94,8529.07,
256,1024,7168,3072,48,6,ActivationType.Silu,torch.bfloat16,torch.float8_e4m3fn,torch.float4_e2m1fn_x2,QuantType.per_1x32,1,0,64,0,338.508,flydsl_moe1_afp8_wfp4_bf16_t64x256x256_w2_bnt0_gui,0.0%,217.7526,flydsl_moe2_afp8_wfp4_bf16_t64x256x256_atomic,0.0%,556.2606,0,0,1459.3,5739.96,
256,2048,7168,3072,48,6,ActivationType.Silu,torch.bfloat16,torch.float8_e4m3fn,torch.float4_e2m1fn_x2,QuantType.per_1x32,1,0,64,0,530.2852,flydsl_moe1_afp8_wfp4_bf16_t64x256x256_w4_bnt0_gui,0.0%,331.0233,flydsl_moe2_afp8_wfp4_bf16_t64x256x256_atomic_persist,0.0%,861.3085,0,0,1884.92,3732.62,
256,4096,7168,3072,48,6,ActivationType.Silu,torch.bfloat16,torch.float8_e4m3fn,torch.float4_e2m1fn_x2,QuantType.per_1x32,1,0,64,0,915.9866,flydsl_moe1_afp8_wfp4_bf16_t64x256x256_w2_bnt0_gui,0.0%,584.6092,flydsl_moe2_afp8_wfp4_bf16_t64x256x256_atomic_persist,0.0%,1500.5958,0,0,2163.8,2171.79,
256,8192,7168,3072,48,6,ActivationType.Silu,torch.bfloat16,torch.float8_e4m3fn,torch.float4_e2m1fn_x2,QuantType.per_1x32,1,0,128,0,1676.9786,flydsl_moe1_afp8_wfp4_bf16_t128x256x256_w3_bnt0_gui_fp8,0.0%,1042.16,flydsl_moe2_afp8_wfp4_bf16_t64x256x256_atomic_sbm128,0.0%,2719.1386,0,0,2388.25,1230.92,
256,16384,7168,3072,48,6,ActivationType.Silu,torch.bfloat16,torch.float8_e4m3fn,torch.float4_e2m1fn_x2,QuantType.per_1x32,1,0,64,0,3295.3371,flydsl_moe1_afp8_wfp4_bf16_t64x256x256_w4_bnt0_gui,0.0%,2081.6506,flydsl_moe2_afp8_wfp4_bf16_t64x256x256_atomic_persist,0.0%,5376.9877,0,0,2415.48,655.24,
256,32768,7168,3072,48,6,ActivationType.Silu,torch.bfloat16,torch.float8_e4m3fn,torch.float4_e2m1fn_x2,QuantType.per_1x32,1,0,64,0,6468.3607,flydsl_moe1_afp8_wfp4_bf16_t64x256x256_w2_bnt0_gui,0.0%,4054.4128,flydsl_moe2_afp8_wfp4_bf16_t64x256x256_atomic_xcd4,0.0%,10522.7735,0,0,2468.55,368.3,
256,1,7168,3072,48,6,ActivationType.Silu,torch.bfloat16,torch.float8_e4m3fn,torch.float4_e2m1fn_x2,QuantType.per_1x32,1,0,32,0,38.40860000000001,cktile_a8w4_bm32,0.0,19.5731,cktile_a8w4_bm32,0.0,57.9817,0,0,0.0,0.0,flydsl_fallback
256,2,7168,3072,48,6,ActivationType.Silu,torch.bfloat16,torch.float8_e4m3fn,torch.float4_e2m1fn_x2,QuantType.per_1x32,1,0,32,0,69.0277,cktile_a8w4_bm32,0.0,32.9666,cktile_a8w4_bm32,0.0,101.9943,0,0,0.0,0.0,flydsl_fallback
256,4,7168,3072,48,6,ActivationType.Silu,torch.bfloat16,torch.float8_e4m3fn,torch.float4_e2m1fn_x2,QuantType.per_1x32,1,0,32,0,88.2746,cktile_a8w4_bm32,0.0,51.5813,cktile_a8w4_bm32,0.0,139.8559,0,0,0.0,0.0,flydsl_fallback
256,8,7168,3072,48,6,ActivationType.Silu,torch.bfloat16,torch.float8_e4m3fn,torch.float4_e2m1fn_x2,QuantType.per_1x32,1,0,32,0,122.1572,cktile_a8w4_bm32,0.0,67.4055,cktile_a8w4_bm32,0.0,189.5627,0,0,0.0,0.0,flydsl_fallback
256,16,7168,3072,48,6,ActivationType.Silu,torch.bfloat16,torch.float8_e4m3fn,torch.float4_e2m1fn_x2,QuantType.per_1x32,1,0,32,0,181.8058,cktile_a8w4_bm32,0.0,86.9238,cktile_a8w4_bm32,0.0,268.7296,0,0,0.0,0.0,flydsl_fallback
256,32,7168,3072,48,6,ActivationType.Silu,torch.bfloat16,torch.float8_e4m3fn,torch.float4_e2m1fn_x2,QuantType.per_1x32,1,0,32,0,188.0609,cktile_a8w4_bm32,0.0,98.8767,cktile_a8w4_bm32,0.0,286.9376,0,0,0.0,0.0,flydsl_fallback
256,64,7168,3072,48,6,ActivationType.Silu,torch.bfloat16,torch.float8_e4m3fn,torch.float4_e2m1fn_x2,QuantType.per_1x32,1,0,32,0,190.2195,cktile_a8w4_bm32,0.0,100.6846,cktile_a8w4_bm32,0.0,290.9041,0,0,0.0,0.0,flydsl_fallback
256,128,7168,3072,48,6,ActivationType.Silu,torch.bfloat16,torch.float8_e4m3fn,torch.float4_e2m1fn_x2,QuantType.per_1x32,1,0,32,0,194.3809,cktile_a8w4_bm32,0.0,101.9792,cktile_a8w4_bm32,0.0,296.3601,0,0,0.0,0.0,flydsl_fallback
256,256,7168,3072,48,6,ActivationType.Silu,torch.bfloat16,torch.float8_e4m3fn,torch.float4_e2m1fn_x2,QuantType.per_1x32,1,0,32,0,264.9727,cktile_a8w4_bm32,0.0,137.2785,cktile_a8w4_bm32,0.0,402.2512,0,0,0.0,0.0,flydsl_fallback
256,512,7168,3072,48,6,ActivationType.Silu,torch.bfloat16,torch.float8_e4m3fn,torch.float4_e2m1fn_x2,QuantType.per_1x32,1,0,64,0,297.0831,cktile_a8w4_bm64,0.0,161.4345,cktile_a8w4_bm64,0.0,458.5176,0,0,0.0,0.0,flydsl_fallback
256,1024,7168,3072,48,6,ActivationType.Silu,torch.bfloat16,torch.float8_e4m3fn,torch.float4_e2m1fn_x2,QuantType.per_1x32,1,0,64,0,457.4316,cktile_a8w4_bm64,0.0,260.7903,cktile_a8w4_bm64,0.0,718.2219,0,0,0.0,0.0,flydsl_fallback
256,2048,7168,3072,48,6,ActivationType.Silu,torch.bfloat16,torch.float8_e4m3fn,torch.float4_e2m1fn_x2,QuantType.per_1x32,1,0,64,0,784.4332,cktile_a8w4_bm64,0.0,441.6577,cktile_a8w4_bm64,0.0,1226.0909,0,0,0.0,0.0,flydsl_fallback
256,4096,7168,3072,48,6,ActivationType.Silu,torch.bfloat16,torch.float8_e4m3fn,torch.float4_e2m1fn_x2,QuantType.per_1x32,1,0,64,0,1387.9338,cktile_a8w4_bm64,0.0,794.5751,cktile_a8w4_bm64,0.0,2182.5089,0,0,0.0,0.0,flydsl_fallback
256,8192,7168,3072,48,6,ActivationType.Silu,torch.bfloat16,torch.float8_e4m3fn,torch.float4_e2m1fn_x2,QuantType.per_1x32,1,0,64,0,2589.6419,cktile_a8w4_bm64,0.0,1493.8495,cktile_a8w4_bm64,0.0,4083.4914,0,0,0.0,0.0,flydsl_fallback
256,16384,7168,3072,48,6,ActivationType.Silu,torch.bfloat16,torch.float8_e4m3fn,torch.float4_e2m1fn_x2,QuantType.per_1x32,1,0,64,0,5029.6624,cktile_a8w4_bm64,0.0,2910.8604,cktile_a8w4_bm64,0.0,7940.5228,0,0,0.0,0.0,flydsl_fallback
256,32768,7168,3072,48,6,ActivationType.Silu,torch.bfloat16,torch.float8_e4m3fn,torch.float4_e2m1fn_x2,QuantType.per_1x32,1,0,64,0,9862.0047,cktile_a8w4_bm64,0.0,5707.6409,cktile_a8w4_bm64,0.0,15569.6456,0,0,0.0,0.0,flydsl_fallback
